{
  "lesson":"day02",
  "task":"task-oxygen-production-001",
  "knowledge":["oxygen-property","oxygen-preparation","chemical-experiment"],
  "activities":[
    {"type":"explore","ref":"observe-experiment"},
    {"type":"learn","ref":"identify-instruments"},
    {"type":"practice","ref":"assemble-apparatus"},
    {"type":"investigate","ref":"analyze-failure"},
    {"type":"transfer","ref":"design-alternative"},
    {"type":"reflect","ref":"self-assessment"}
  ],
  "assessment":{
    "questions":[],
    "bloomLevels":["understand","apply","analyze","evaluate","create"],
    "masteryTarget":0.8
  },
  "nextTasks":[]
}
